{
  "$schema": "../schemas/monetization.schema.json",
  "schemaVersion": 1,
  "ads": {
    "enabled": true,
    "rewarded": {
      "placements": [
        {
          "id": "continue_moves",
          "kind": "continue"
        },
        {
          "id": "free_coins",
          "kind": "free_coins"
        }
      ],
      "dailyCap": 10
    },
    "interstitial": {
      "enabled": true,
      "minLevel": 6,
      "everyNLevels": 3,
      "cooldownSeconds": 120
    },
    "banner": {
      "enabled": false,
      "screens": []
    }
  },
  "removeAdsEntitlement": "no_ads",
  "iap": {
    "enabled": true
  }
}
